{
  "schema_version": "1.5.0",
  "status": "succeeded",
  "http_status": 200,
  "data_namespace": "product",
  "run_id": "run_a1beca0db34b4ef8b977e0e0b1bf16fd",
  "links": {
    "status": "http://127.0.0.1:8000/v1/research-runs/run_a1beca0db34b4ef8b977e0e0b1bf16fd",
    "result": "http://127.0.0.1:8000/v1/research-runs/run_a1beca0db34b4ef8b977e0e0b1bf16fd/result",
    "trace": "http://127.0.0.1:8000/v1/research-runs/run_a1beca0db34b4ef8b977e0e0b1bf16fd/trace",
    "cancel": "http://127.0.0.1:8000/v1/research-runs/run_a1beca0db34b4ef8b977e0e0b1bf16fd/cancel"
  },
  "request": {
    "task_type": "filing_analysis",
    "company_ids": [
      "cn_002594"
    ],
    "requested_period_labels": [
      "2024H1"
    ],
    "research_question": "2024H1利润是否真正转化成了经营现金流?",
    "research_time": "2026-09-03T00:00:00+08:00",
    "idempotency_key": "n8n-smoke-5f2d9dc35a264dbb9aaea29127185178"
  },
  "conclusion": "比亚迪股份有限公司2024H1经营现金流/净利润为1.04倍, 毛利率为20.01%; 未触发预设的背离信号。结论仅覆盖已核验财务事实, 不构成投资建议。",
  "findings": [
    {
      "alternative_explanations": [
        "经营现金流与利润确认节奏可能受营运资本时点影响。"
      ],
      "claim_id": "claim_run_a1beca0db34b4ef8b977e0e0b1bf16fd_cn_002594_earnings_quality",
      "claim_type": "earnings_quality",
      "confidence": {
        "basis": "结论直接依赖两个已核验财务事实和确定性公式。",
        "level": "high"
      },
      "counter_evidence_search": {
        "evidence_ids": [
          "chunk_product_byd_2024h1_non_recurring_profit",
          "chunk_product_byd_2024h1_unaudited_interim_report"
        ],
        "performed": true,
        "queries": [
          "利润质量反证: 非经常性损益、审计状态与口径限制"
        ],
        "result": "found",
        "summary": "该官方披露中已定位: 扣除非经常性损益后的净利润披露、财务报告未经审计; 不应仅凭单期现金转化外推长期收益质量。"
      },
      "direction": "positive",
      "epistemic_status": "supported_inference",
      "fact_ids": [
        "fact_product_byd_2024h1_net_income",
        "fact_product_byd_2024h1_operating_cash_flow"
      ],
      "materiality": "material",
      "schema_version": "1.4.0",
      "support_evidence_ids": [
        "chunk_product_byd_2024h1_net_income",
        "chunk_product_byd_2024h1_operating_cash_flow"
      ],
      "text": "经营现金流与净利润的现金转化比为1.04倍, 未触发预设的背离信号。"
    },
    {
      "alternative_explanations": [],
      "claim_id": "claim_run_a1beca0db34b4ef8b977e0e0b1bf16fd_cn_002594_gross_margin",
      "claim_type": "observation",
      "confidence": {
        "basis": "营业收入、营业成本与公式均已冻结。",
        "level": "high"
      },
      "counter_evidence_search": {
        "evidence_ids": [],
        "performed": false,
        "queries": [],
        "result": "not_applicable",
        "summary": "该支持性观察不单独触发反证搜索。"
      },
      "direction": "neutral",
      "epistemic_status": "verified_fact",
      "fact_ids": [
        "fact_product_byd_2024h1_revenue",
        "fact_product_byd_2024h1_operating_cost"
      ],
      "materiality": "supporting",
      "schema_version": "1.4.0",
      "support_evidence_ids": [
        "chunk_product_byd_2024h1_operating_cost",
        "chunk_product_byd_2024h1_revenue"
      ],
      "text": "按营业收入减营业成本计算, 2024H1毛利率为20.01%。"
    }
  ],
  "financial_facts": [
    {
      "availability": "available",
      "canonical_scale": 1,
      "company": {
        "company_id": "cn_002594",
        "country_code": "CN",
        "exchange": "SZSE",
        "legal_name": "比亚迪股份有限公司",
        "ticker": "002594"
      },
      "created_at": "2026-09-03T22:42:00+08:00",
      "currency": "CNY",
      "derivation": null,
      "fact_id": "fact_product_byd_2024h1_accounts_receivable",
      "fact_kind": "reported",
      "formula_version": null,
      "measurement_unit": "CURRENCY",
      "metric_code": "accounts_receivable",
      "period": {
        "accounting_standard": "CAS",
        "fiscal_period": "H1",
        "fiscal_year": 2024,
        "period_basis": "ytd",
        "period_end": "2024-06-30",
        "period_start": "2024-01-01",
        "restatement_status": "as_reported",
        "statement_scope": "consolidated"
      },
      "quality_flags": [
        "unit_normalized"
      ],
      "schema_version": "1.4.0",
      "sign_convention": "natural_statement_value",
      "source": {
        "content_hash": "769e9fc195141e7f525d65f0daa308d441c7e39408f0dd584a3722cfc8a306ba",
        "document_id": "doc_product_byd_2024h1",
        "license_id": null,
        "published_at": "2024-08-29T23:59:59+08:00",
        "redistribution_allowed": false,
        "retrieved_at": "2026-09-03T22:42:00+08:00",
        "source_id": "source_cninfo",
        "source_type": "official_filing",
        "uri": "https://static.cninfo.com.cn/finalpage/2024-08-29/1221030552.PDF"
      },
      "source_fact_ids": [],
      "source_locator": {
        "column_label": "2024年6月30日",
        "page": 81,
        "row_label": "应收账款",
        "section": "财务报表",
        "table": "合并资产负债表"
      },
      "value": "71814516000"
    },
    {
      "availability": "available",
      "canonical_scale": 1,
      "company": {
        "company_id": "cn_002594",
        "country_code": "CN",
        "exchange": "SZSE",
        "legal_name": "比亚迪股份有限公司",
        "ticker": "002594"
      },
      "created_at": "2026-09-03T22:42:00+08:00",
      "currency": "CNY",
      "derivation": null,
      "fact_id": "fact_product_byd_2024h1_inventory",
      "fact_kind": "reported",
      "formula_version": null,
      "measurement_unit": "CURRENCY",
      "metric_code": "inventory",
      "period": {
        "accounting_standard": "CAS",
        "fiscal_period": "H1",
        "fiscal_year": 2024,
        "period_basis": "ytd",
        "period_end": "2024-06-30",
        "period_start": "2024-01-01",
        "restatement_status": "as_reported",
        "statement_scope": "consolidated"
      },
      "quality_flags": [
        "unit_normalized"
      ],
      "schema_version": "1.4.0",
      "sign_convention": "natural_statement_value",
      "source": {
        "content_hash": "769e9fc195141e7f525d65f0daa308d441c7e39408f0dd584a3722cfc8a306ba",
        "document_id": "doc_product_byd_2024h1",
        "license_id": null,
        "published_at": "2024-08-29T23:59:59+08:00",
        "redistribution_allowed": false,
        "retrieved_at": "2026-09-03T22:42:00+08:00",
        "source_id": "source_cninfo",
        "source_type": "official_filing",
        "uri": "https://static.cninfo.com.cn/finalpage/2024-08-29/1221030552.PDF"
      },
      "source_fact_ids": [],
      "source_locator": {
        "column_label": "2024年6月30日",
        "page": 81,
        "row_label": "存货",
        "section": "财务报表",
        "table": "合并资产负债表"
      },
      "value": "112753013000"
    },
    {
      "availability": "available",
      "canonical_scale": 1,
      "company": {
        "company_id": "cn_002594",
        "country_code": "CN",
        "exchange": "SZSE",
        "legal_name": "比亚迪股份有限公司",
        "ticker": "002594"
      },
      "created_at": "2026-09-03T22:42:00+08:00",
      "currency": "CNY",
      "derivation": null,
      "fact_id": "fact_product_byd_2024h1_net_income",
      "fact_kind": "reported",
      "formula_version": null,
      "measurement_unit": "CURRENCY",
      "metric_code": "net_income",
      "period": {
        "accounting_standard": "CAS",
        "fiscal_period": "H1",
        "fiscal_year": 2024,
        "period_basis": "ytd",
        "period_end": "2024-06-30",
        "period_start": "2024-01-01",
        "restatement_status": "as_reported",
        "statement_scope": "consolidated"
      },
      "quality_flags": [
        "unit_normalized"
      ],
      "schema_version": "1.4.0",
      "sign_convention": "natural_statement_value",
      "source": {
        "content_hash": "769e9fc195141e7f525d65f0daa308d441c7e39408f0dd584a3722cfc8a306ba",
        "document_id": "doc_product_byd_2024h1",
        "license_id": null,
        "published_at": "2024-08-29T23:59:59+08:00",
        "redistribution_allowed": false,
        "retrieved_at": "2026-09-03T22:42:00+08:00",
        "source_id": "source_cninfo",
        "source_type": "official_filing",
        "uri": "https://static.cninfo.com.cn/finalpage/2024-08-29/1221030552.PDF"
      },
      "source_fact_ids": [],
      "source_locator": {
        "column_label": "截至2024年6月30日止6个月期间",
        "page": 84,
        "row_label": "归属于母公司所有者的净利润",
        "section": "财务报表",
        "table": "合并利润表"
      },
      "value": "13631257000"
    },
    {
      "availability": "available",
      "canonical_scale": 1,
      "company": {
        "company_id": "cn_002594",
        "country_code": "CN",
        "exchange": "SZSE",
        "legal_name": "比亚迪股份有限公司",
        "ticker": "002594"
      },
      "created_at": "2026-09-03T22:42:00+08:00",
      "currency": "CNY",
      "derivation": null,
      "fact_id": "fact_product_byd_2024h1_operating_cash_flow",
      "fact_kind": "reported",
      "formula_version": null,
      "measurement_unit": "CURRENCY",
      "metric_code": "operating_cash_flow",
      "period": {
        "accounting_standard": "CAS",
        "fiscal_period": "H1",
        "fiscal_year": 2024,
        "period_basis": "ytd",
        "period_end": "2024-06-30",
        "period_start": "2024-01-01",
        "restatement_status": "as_reported",
        "statement_scope": "consolidated"
      },
      "quality_flags": [
        "unit_normalized"
      ],
      "schema_version": "1.4.0",
      "sign_convention": "natural_statement_value",
      "source": {
        "content_hash": "769e9fc195141e7f525d65f0daa308d441c7e39408f0dd584a3722cfc8a306ba",
        "document_id": "doc_product_byd_2024h1",
        "license_id": null,
        "published_at": "2024-08-29T23:59:59+08:00",
        "redistribution_allowed": false,
        "retrieved_at": "2026-09-03T22:42:00+08:00",
        "source_id": "source_cninfo",
        "source_type": "official_filing",
        "uri": "https://static.cninfo.com.cn/finalpage/2024-08-29/1221030552.PDF"
      },
      "source_fact_ids": [],
      "source_locator": {